0	Which of the following is a disadvantage of decision trees?	Decision trees are prone to be overfit	Factor analysis, Decision trees are robust to outliers, Decision trees are prone to be overfit, None of the above
1	How we can avoid the overfitting in Decision Tree?	Both of above	CHAID(Stopping the Tree Growth), Pruning the Full Grown Tree, Both of above, None of the Above
2	Which of the following is/are true about bagging trees? <br>1. In bagging trees, individual trees are independent of each other; <br>2. Bagging is the method for improving the performance by aggregating the results of weak learners.	1 and 2	1, 2, 1 and 2, None of these
3	Which of the following is/are true about boosting trees?In boosting trees<br>1. individual weak learners are independent of each other;<b3>2. It is the method for improving the performance by aggregating the results of weak learners.	2	1, 2, 1 and 2, None of these
4	In Random forest you can generate hundreds of trees (say T1, T2 …..Tn) and then aggregate the results of these tree. Which of the following is true about individual(Tk) tree in Random Forest?<br> 1. Individual tree is built on a subset of the features;<br> 2.Individual tree is built on all the features;<br> 3. Individual tree is built on a subset of observations; <br>4. Individual tree is built on full set of observations.	1 and 3	1 and 3, 1 and 4, 2 and 3, 2 and 4
5	Suppose you are using a bagging based algorithm say a RandomForest in model building. Which of the following can be true?<br> 1. Number of tree should be as large as possible; <br>2. You will have interpretability after using RandomForest.	1	1, 2, 1 and 2, None of these
6	The leaf nodes of a model tree are	linear regression equations	nonlinear regression equations, linear regression equations, sums of numeric output attribute values.
7	Regression trees are often used to model _______ data.	nonlinear	linear, nonlinear, categorical, symmetrical